{
  "change_id": "main-push-contract-test",
  "design_package_ref": "examples/warehouse-tote/design-package.json",
  "design_package_sha256": "062ef44e92613fe7855b262a5a22c7a85ae1f96e62b251cb63cebf950162e4a0",
  "base_revision": "837da9e4e4f06f6dd1494addd8743779637808d4",
  "objective": "Keep ChangeContract trust-boundary tests deterministic in both PR and main push CI.",
  "in_scope": [
    "Pin the forged-base regression to the PR event context while retaining the separate main-push regression.",
    "Record the post-merge CI failure and its bounded correction."
  ],
  "out_of_scope": [
    "ChangeContract production validation logic, SafetyGate behavior, and physical output."
  ],
  "allowed_paths": [
    "changes/main-push-contract-test/change.json",
    "tests/unit/test_change_contract.py",
    "docs/work-memory/current.md"
  ],
  "affected_requirement_ids": ["REQ-SIM-STOP"],
  "invariants": [
    "Forged contract baselines remain rejected for PR and main push events.",
    "SafetyGate stays fail-closed and physical output remains disabled."
  ],
  "required_test_ids": ["T-SIM-GRAPH"],
  "stop_conditions": [
    "The contract scope or design references fail validation.",
    "A repository check, Jazzy test, or CI evidence gate fails."
  ]
}
